{
  "schemaVersion": 1,
  "id": "central-asia-silk-roads",
  "legacyStorageKey": "atlas-central-asia-journal",
  "status": "review",
  "sequence": 4,
  "region": {
    "name": "Central Asia",
    "center": [
      66.3,
      40.4
    ],
    "zoom": 4.6
  },
  "interests": [
    "history",
    "geology",
    "culture",
    "archaeology",
    "cartography",
    "ecology"
  ],
  "knowledgePaths": [
    "geology",
    "cartography",
    "history",
    "culture",
    "archaeology",
    "ecology"
  ],
  "editorial": {
    "contentVersion": "1.1.0",
    "reviewStatus": "reviewed",
    "reviewedBy": "Atlas Beyond source-rights audit",
    "reviewedAt": "2026-08-23"
  },
  "sources": [
    {
      "id": "source-whc-unesco-org-61w5wx",
      "title": "Tian Shan Corridor · Chuy Valley",
      "publisher": "UNESCO World Heritage Centre",
      "url": "https://whc.unesco.org/en/list/1442/",
      "accessedAt": "2026-08-23",
      "license": {
        "status": "restricted",
        "usage": "facts-only",
        "termsUrl": "https://whc.unesco.org/en/disclaimer",
        "notes": "Reference-only: Atlas Beyond links by plain text and independently restates facts. No UNESCO prose, data feed, image, emblem, or other protected element is copied. Written permission is required before reproducing WHC content.",
        "reviewedAt": "2026-08-23",
        "reviewedBy": "Atlas Beyond source-rights audit"
      }
    },
    {
      "id": "source-whc-unesco-org-vvvrv9",
      "title": "Samarkand · Zerafshan Oasis",
      "publisher": "UNESCO World Heritage Centre",
      "url": "https://whc.unesco.org/en/list/603/",
      "accessedAt": "2026-08-23",
      "license": {
        "status": "restricted",
        "usage": "facts-only",
        "termsUrl": "https://whc.unesco.org/en/disclaimer",
        "notes": "Reference-only: Atlas Beyond links by plain text and independently restates facts. No UNESCO prose, data feed, image, emblem, or other protected element is copied. Written permission is required before reproducing WHC content.",
        "reviewedAt": "2026-08-23",
        "reviewedBy": "Atlas Beyond source-rights audit"
      }
    },
    {
      "id": "source-whc-unesco-org-vvx7ug",
      "title": "Ancient Merv · Murghab Oasis",
      "publisher": "UNESCO World Heritage Centre",
      "url": "https://whc.unesco.org/en/list/886/",
      "accessedAt": "2026-08-23",
      "license": {
        "status": "restricted",
        "usage": "facts-only",
        "termsUrl": "https://whc.unesco.org/en/disclaimer",
        "notes": "Reference-only: Atlas Beyond links by plain text and independently restates facts. No UNESCO prose, data feed, image, emblem, or other protected element is copied. Written permission is required before reproducing WHC content.",
        "reviewedAt": "2026-08-23",
        "reviewedBy": "Atlas Beyond source-rights audit"
      }
    },
    {
      "id": "unesco-samarkand",
      "title": "Samarkand – Crossroad of Cultures",
      "publisher": "UNESCO World Heritage Centre",
      "url": "https://whc.unesco.org/en/list/603/",
      "accessedAt": "2026-08-23",
      "license": {
        "status": "restricted",
        "usage": "facts-only",
        "termsUrl": "https://whc.unesco.org/en/disclaimer",
        "notes": "Reference-only: Atlas Beyond links by plain text and independently restates facts. No UNESCO prose, data feed, image, emblem, or other protected element is copied. Written permission is required before reproducing WHC content.",
        "reviewedAt": "2026-08-23",
        "reviewedBy": "Atlas Beyond source-rights audit"
      }
    },
    {
      "id": "unesco-bukhara",
      "title": "Historic Centre of Bukhara",
      "publisher": "UNESCO World Heritage Centre",
      "url": "https://whc.unesco.org/en/list/602/",
      "accessedAt": "2026-08-23",
      "license": {
        "status": "restricted",
        "usage": "facts-only",
        "termsUrl": "https://whc.unesco.org/en/disclaimer",
        "notes": "Reference-only: Atlas Beyond links by plain text and independently restates facts. No UNESCO prose, data feed, image, emblem, or other protected element is copied. Written permission is required before reproducing WHC content.",
        "reviewedAt": "2026-08-23",
        "reviewedBy": "Atlas Beyond source-rights audit"
      }
    },
    {
      "id": "unesco-central-sites",
      "title": "Silk Roads heritage sites",
      "publisher": "UNESCO World Heritage Centre",
      "url": "https://whc.unesco.org/en/list/1442/",
      "accessedAt": "2026-08-23",
      "license": {
        "status": "restricted",
        "usage": "facts-only",
        "termsUrl": "https://whc.unesco.org/en/disclaimer",
        "notes": "Reference-only: Atlas Beyond links by plain text and independently restates facts. No UNESCO prose, data feed, image, emblem, or other protected element is copied. Written permission is required before reproducing WHC content.",
        "reviewedAt": "2026-08-23",
        "reviewedBy": "Atlas Beyond source-rights audit"
      }
    },
    {
      "id": "unesco-merv",
      "title": "State Historical and Cultural Park Ancient Merv",
      "publisher": "UNESCO World Heritage Centre",
      "url": "https://whc.unesco.org/en/list/886/",
      "accessedAt": "2026-08-23",
      "license": {
        "status": "restricted",
        "usage": "facts-only",
        "termsUrl": "https://whc.unesco.org/en/disclaimer",
        "notes": "Reference-only: Atlas Beyond links by plain text and independently restates facts. No UNESCO prose, data feed, image, emblem, or other protected element is copied. Written permission is required before reproducing WHC content.",
        "reviewedAt": "2026-08-23",
        "reviewedBy": "Atlas Beyond source-rights audit"
      }
    },
    {
      "id": "nasa-aral",
      "title": "World of Change: Shrinking Aral Sea",
      "publisher": "NASA Earth Observatory",
      "url": "https://earthobservatory.nasa.gov/world-of-change/AralSea",
      "accessedAt": "2026-08-23",
      "license": {
        "status": "approved",
        "usage": "facts-only",
        "termsUrl": "https://www.nasa.gov/nasa-brand-center/images-and-media/",
        "notes": "Approved for independently written factual and informational use under NASA media guidelines. No NASA logos, media, or endorsement claims are used.",
        "reviewedAt": "2026-08-23",
        "reviewedBy": "Atlas Beyond source-rights audit"
      }
    }
  ],
  "locales": {
    "en": {
      "title": "Roads between worlds.",
      "eyebrow": "Field expedition 004 · Central Asia",
      "intro": "Across mountain corridors, river oases, and layered cities, read how geography turned movement into exchange."
    },
    "fr": {
      "title": "Routes entre les mondes.",
      "eyebrow": "Expédition 004 · Asie centrale",
      "intro": "À travers cols, oasis et villes stratifiées, découvrez comment la géographie transforma le mouvement en échange."
    },
    "sv": {
      "title": "Vägar mellan världar.",
      "eyebrow": "Fältexpedition 004 · Centralasien",
      "intro": "Genom bergskorridorer, flodoaser och städernas lager visar geografin hur rörelse blev till utbyte."
    }
  },
  "discoveries": [
    {
      "id": "tian-shan-corridor-chuy-valley",
      "kind": "investigation",
      "order": 1,
      "optional": false,
      "coordinates": [
        75.25,
        42.75
      ],
      "categories": [
        "history",
        "geology"
      ],
      "knowledgeReward": {
        "path": "geology",
        "points": 1,
        "unlockLevel": 0
      },
      "claims": [
        {
          "id": "tian-shan-corridor-chuy-valley-core-claim",
          "text": "The Silk Roads functioned as a supported network: geography shaped the paths, while water and settlements kept exchange moving.",
          "sourceIds": [
            "source-whc-unesco-org-61w5wx"
          ],
          "reviewStatus": "draft",
          "uncertainty": "low"
        }
      ],
      "locales": {
        "en": {
          "place": "Tian Shan Corridor · Chuy Valley",
          "clue": "A road is more than a line",
          "fieldNote": "Look for the systems that made long-distance movement possible across extreme terrain.",
          "evidence": [
            {
              "label": "Terrain",
              "text": "Routes crossed deserts, alpine passes, river valleys, and fertile steppe.",
              "claimIds": [
                "tian-shan-corridor-chuy-valley-core-claim"
              ]
            },
            {
              "label": "Support",
              "text": "Forts, way stations, caravanserais, and settlements sheltered travellers.",
              "claimIds": [
                "tian-shan-corridor-chuy-valley-core-claim"
              ]
            },
            {
              "label": "Water",
              "text": "Canals, wells, and reservoirs sustained towns and agriculture.",
              "claimIds": [
                "tian-shan-corridor-chuy-valley-core-claim"
              ]
            }
          ],
          "question": "What allowed this corridor to carry exchange across thousands of kilometres?",
          "options": [
            "A connected network of routes, water systems, and protected stopping places",
            "A single paved road with no settlements",
            "Travel only during frozen winters"
          ],
          "correct": 0,
          "reveal": "The Silk Roads functioned as a supported network: geography shaped the paths, while water and settlements kept exchange moving."
        },
        "fr": {
          "place": "Corridor du Tian Shan · Vallée de Tchouï",
          "clue": "Une route est plus qu’une ligne",
          "fieldNote": "Repérez les systèmes qui rendaient possible le voyage à travers des terrains extrêmes.",
          "evidence": [
            {
              "label": "Relief",
              "text": "Les routes traversaient déserts, cols alpins, vallées et steppes fertiles.",